Keyword,Intent,Target Page,Priority,Status,Notes
eco friendly packaging supplier,Commercial,Homepage,High,Research needed,B2B supplier intent
sustainable packaging for business,Informational,Service Page,High,Research needed,Lead education
biodegradable carry bags bulk,Commercial,Product Page,High,Research needed,Quote intent
custom eco friendly packaging,Commercial,Service Page,Medium,Research needed,Branding intent
compostable packaging supplier,Commercial,Category Page,Medium,Research needed,Category intent
